text;plus;minus;language;rating
Запах просто классный, как раз то, что мне нужно в летнее время. Принимаю душ и брызгаюсь, а дальше парфюм делает своё дело - он проявляет не запах какого-то парфюма, а мой, именно запах моего тела после душа, такой чистый запах, а после, когда уже температура тела горячая, аромат будто уже проявляет себя, запах каких-то нежных цветов, и то едва уловим, появляется и снова исчезает, будто порхает, не похож не на какие другие. Я рада, что приобрела данный аромат, мне как раз нравится, когда я не слышу свой парфюм у других рядом находящихся людей;Мне все понравилось - и качество товара, и запах, как я и ожидала, прям суперский, и доставили очень быстро;Единственное, что мне не понравилось, это то, что курьер не захотел подниматься до квартиры и сказал, чтобы я спустилась, настоял на этом;russian;4.0
Брала для сына.;Советую.;Запах отличный, но стойкость не очень.;russian;3.0
Доставка очень быстрая;Запах обалденный;Такого ничего нет;russian;5.0
Мне больше сильвер маунтин нравится, чем авентус;Аромат классный;Цена не очень-то соответствует качеству;russian;4.0
Устойчивый запах. Покупайте;Всё отлично, супер;Когда сильная жара, не используйте;russian;5.0
Не советую, нестойкий запах. Наверное, не оригинал.;Запах хороший.;Нестойкий.;russian;1.0
Духи супер.;Запах тот, который я хотела, доставка вовремя. Запах стойкий, прям по моему характеру! Советую приобретать.;Цена конечно большая.;russian;4.0
Ночью заказала, на следующий день позвонили и уже днем доставили, APG техникс;Мне понравилось. Очень женственный, нежный ;Но нестойкий;russian;4.0
Жаль, конечно! Стоит совсем новый!;Красивый бутыль.;Запах нестойкий! Один спирт! Такое ощущение, как будто вода с ароматом плюс спирт!;russian;1.0
Запах хороший, но не стойкий.;Запах тот, что и хотела.;Быстро выветривается.;russian;5.0
Мягкий, очень нежный аромат;Запах отличный, долго держится!;Все ок;russian;5.0
Вроде парфюм, но как туалетная вода;Заказ приняли быстро. Доставку организовали даже раньше. Сервис Каспи Магазина понравился. Еще раз, думаю, что-нибудь приобрету;Немножко отличается от покупки в дьюти фри. Не так устойчив;russian;3.0
Восхитительный аромат;Очень качественный парфюм;Понравилось все;russian;5.0
Спасибо магазину APG техникс, доставка и обслуживание на высшем уровне);Стойкий, качественный аромат! Цена за такой объем радует);Претензий нет;russian;5.0
Спасибо за быструю и оперативную доставку! Пришло все в целости и сохранности);Запах приятный, распыляется очень хорошо. На каждый день нормально.;Запах держится не так уж и долго.;russian;4.0
Что сказать, пользуйтесь сайтом, заказывайте, все вовремя доставляют. Вежливый и доброжелательный курьер.;Здравствуйте. Заказывала духи Cachatel Amor Amor с доставкой на дом. Всем довольна! Это мой аромат, пользуюсь ими не первый год и всегда знаю, что беру,  так и в этот раз не ошиблась. Духи те самые, мои любимые, привезли и передали прям мне в ручки!;Нет ничего, что мне не понравилось, все отлично.;russian;5.0
Хороший товар;Классный запах;Всё понравилось;russian;5.0
Ну вроде запах хороший. Если все понравится, хочу потом заказать и мужу.;Запах стойкий, вроде оригинал.);Курьер очень торопился, такое ощущение было. Быстро оставить товар, всучить и все);russian;5.0
Спасибо магазину Parfum-Shop-kz, уже не раз у вас заказываю, все вовремя и очень удобно!;Очень стойкий запах! Покупала маме в подарок, все понравилось! Классический, не терпкий и приятный запах! ;Все понравилось, никаких нареканий нет!;russian;5.0
Не превзошел мои ожидания((( не стойкий ну вообще(;Это эталон мужской парфюмерии;Шлейф не остается, вшыкаешь, пропадает запах через короткое время, либо мне отправили не оригинальный парфюм(;russian;3.0
На любителя;Упаковка, флакон;Не превзошёл мои ожидания;russian;4.0
Спасибо Каспи за удобство, что не выходя из дома можно приобрести практически всё, что угодно. ;"Запах парфюма понравился, всем советую!<br>
Доставка сроком раньше, буквально на следующий день после заказа, оперативно. Спасибо за это.";"Курьер вначале когда связался по телефону, был немного грубоват тем, что не смог конкретно ответить на волнующие вопросы с моей стороны, а именно на вопрос: сертифицирован ли парфюм не подделка, на что он неуверенно ответил немного даже грубо: ""моё дело поставлять, а за товар не в ответе"", что якобы за свой регион местности, т.е. Тараз, уверенно дал бы ответ. Вот это немного насторожило. Просьба любому курьеру и продавцам магазинов быть уверенным в своих товарах и вежливым, если товар соответствует своим качествам.";russian;5.0
Буду заказывать еще.;Супер. На лето самое то, очень нежный, тонкий аромат.;Все понравилось.;russian;5.0
Заказывайте через Каспий, т.к. оплата удобная;Отличный запах духов;Все отлично;russian;5.0
На зиму брал, к лету опять возьму свой любимый VERSACE EROS. Но этот увы больше похож на породие D&G The one.;Коробка и флакон очень богатый. Надписи на немецком языке на основной коробке и транспортировочной. Да, этот аромат с Германии.;Не совсем то что я ожидал. Аромат больше для мужчин старше 40. Хотя мне всего то 28. Может аромат и был хорош в 2007 году, к сожалению с современными ароматами он не сравниться. Разочарован. Впредь, слепо брать аромат смотря обзоры не буду. Не мое. Аромат очень простой и не замудреный, на любителя.;russian;3.0
Хороший парфюм на любителя, похож чем-то на Kenzo, в общем, пользоваться можно.;Запах супер.;Быстро выветривается, пару часиков, и все.;russian;3.0
Товар оставляет желать лучшего.;Вкусный, красивый.;Нестойкий, все мои близкие сказали, что он не оригинал. Было неприятно это слышать, но что поделать(;russian;3.0
Доставку сделали быстро и очень профессионально. Каспи, ты лучший.;Шикарный, дорогой запах. Лично я влюбилась в него с первого раза. Решила рискнуть и подарить мужу. Ему очень понравился аромат;Никаких претензий.;russian;5.0
Цена соответствует качеству. Нам еще повезло, купили со скидкой, так как действовала акция.;Парфюм очень понравился! Подарила мужу на 7 мая, он очень обрадовался. Флакон хорошо упаковали. Доставку произвели раньше, чем я ожидала.;Хотела устроить сюрприз мужу, но курьер не приехал по указанному адресу. Хотел чтобы я подъехала туда, где он находился, ссылаясь на то, что плохо знает наш город и что он там ждет других клиентов. Пришлось отправить мужа за ним, сама не смогла выйти с ребенком. Работа курьера не понравилась.;russian;5.0
Благородный аромат, не душит окружающих. Нравится.;Качественный парфюм.;Не очень стойкий.;russian;5.0
Духи, которые я брала раньше, были более стойкие. Запах держался до следующей стирки одежды.;Доставили в течении суток. Стандартная хорошая упаковка.;Не стойкие.;russian;4.0
Каспи, спасибо, быстро доставили. Посылку получила в фирменной коробке магазина, это означает, что товар именно от этого магазина. ;Запах классный, как я хотела, не ошиблась, выбирала по отзывам и цена приемлемая. ;Запах не стойкий, быстро улетучивается.;russian;3.0
Жду новинку от ланвин.;Заказ пришел быстрее, чем я ожидала, парфюм мне очень понравился, запах нежный и стойкий. Рекомендую всем! Спасибо Каспи.;Флакон маленький.;russian;5.0
В целом хорош.;Пойдет для ежедневного пользования.;Запах не оправдал ожиданий.;russian;4.0
Доставка быстрая.;Аромат парфюма отличный!;Запах парфюма держится недолго, хватает на 2 или 3 часа.;russian;5.0
Просто супер.;Очень хороший одеколон. Вовремя доставили.;Нет такого.;russian;5.0
Возьмёте, не пожалеете;Очень крутой запах, стойкий, мне понравилось;Все понравилось;russian;5.0
Лучше не покупать.;Запах 100% - Крид Авентус.;Стойкость очень слабая.;russian;3.0
А доставка на высоте) За доставку 5;Запах почти один в один с Авентус.;Вообще не стойкий.;russian;2.0
Вкусы у всех индивидуальны, поэтому рекомендую опробовать в магазине города.;Качественный товар по приятной цене с удобной доставкой. Покупала для подарка мужу, аромат понравился обоим.;Немного резковат в начале, но постепенно ощущение проходит.;russian;5.0
Товар понравился. Просьба сделать доставку до места назначения, которое указано в заявке.;Товар соответствует характеристикам. Запах не резкий, не сладкий. Доставили быстро.;Не понравилось, что доставка не до места назначения, которая указана в заявке, пришлось ехать в другой город. А цена за доставку дополнительно отдельно включена в цену товара.;russian;4.0
Упаковка на высшем уровне;Хороший запах, стойкий;Нет;russian;5.0
Хороший парфюм! Как и писали ранее другие, вначале немного резкий, но через 10-15 минут успокаивается.;Приятный запах, держится достаточно долго, шлейф остаётся даже после нескольких часов.;Немного резкий и приторный вначале.;russian;5.0
Рекомендую;Ожидания оправдались. Запах стойкий. Доставка проведена очень быстро. Спасибо Каспи;Замечаний нет;russian;5.0
Все супер;Доставили быстро, запах нежный, не острый. Мне очень понравилось. Цена=качество;Все ок;russian;5.0
"А вообще он очень классный, прям свожу всех с ума с этим ароматом! Люблю lanvin princess!<br>
И снова спасибо Каспи) Это вообще супер - не выходя из дома можно приобрести себе нужное!";Вообще аромат мой одних из любимых! Обожаю принцессу) ;Единственное, что я заметила, легко улетучивается запах( Неустойчивым оказался в этот раз.;russian;3.0
Один из моих любимых ароматов. Очень нежный, восхитительный запах. Но покупать в этом магазине я бы не советовала.;Объем большой. Быстро доставили, буквально в тот же день. Курьер вежливый.;Не стойкий, не оправдал ожиданий.;russian;2.0
Другой хочу заказать hugo boss;Оригинал. Стойкий запах;Мне не нравится сам запах. А так хороший;russian;5.0
Не стоит своих денег. Очень слабый запах.;Запах хороший.;Аромат не стойкий. ;russian;2.0
Супер;Запах очень классный, стойкий, оргинал;Магазин еле нашла;russian;5.0
И доставка очень быстрая;Запах очень нравится! Красивый дизайн;Ничего;russian;5.0
Рекомендую;Мой любимый аромат;Всё понравилось);russian;5.0
Курьер просто  молодец очень вежливый. Знает свою работу, побольше таких замечательных людей.;Запах не мой! Пахнет лимоном,  зато  дочь довольна.;Слишком цитрусовый.;russian;4.0
"Доставили раньше заявленной даты.
Курьер очень вежливый.";Парфюм приятный.;"Стойкости честно нет вообще никакой.
В данном магазине хотели приобрести еще другой аромат, но не рискнули.";russian;4.0
Получила на удивление раньше, чем ожидалось, огромное благодарность за это. Доставка прямо в руки, товар был упакован так, что коробка не помялась. ;Пользуюсь этой фирмой вот уже более 10 лет, запах обалденный. Куда бы ни пошла, все не стесняясь спрашивают о нем. Все супер, рекомендую.;Пока нет.;russian;5.0
Советую всем;Прекрасный аромат. Не резкий. Когда заказывала, побаивалась, но аромат превзошёл мои ожидания;Все понравилось;russian;5.0
Нашла то, что искала. Прям вот из 90х.) Молодежь заценила;Стойкий аромат, щелчок крышки все говорит о соответствии качеству;Все отлично;russian;5.0
Больше всего обрадовал курьер, который бережно спрятал товар под забор, как я просила, так как была на работе, и некому было принять товар. :);Покупкой довольна. Запах стойкий.;Пришло сообщение, что товар доставят 13.07, но доставили на 2 дня раньше, и это доставило некоторые неудобства.;russian;4.0
Стойкий и обалденный запах;Заказала парфюм. Очень сильно понравился! Запах обалденный! Рекомендую, советую. Доставка очень быстрая. Спасибо за сервис! Буду теперь  с вами работать. Удачи и процветания вам;Нет комментариев;russian;5.0
Всё хорошо;Стойкие духи;Ничего;russian;5.0
Советую всем парфюм от Paco rabane ultraviolet.;Заказала себе на 8 марта. Этим парфюмом пользуюсь очень давно. Курьер доставил очень быстро, вежливый!;Но есть одно но - нестойкий. Стойкость 1 день. Так как это мой любимый парфюм, я, конечно, довольна.;russian;5.0
Приятная цена!;Очень приятный аромат, девушка тоже в восторге. Так что, я доволен покупкой!;Минусов нет.;russian;5.0
 Доставка была оперативная.;Для тех, кто любит сладковатые запахи. Приятный аромат.;Но нестойкий.;russian;3.0
Спасибо Каспи Банку;Оригинальные духи;Претензий нет;russian;5.0
"Это божественный аромат! От комплиментов и вопросов ""какой это аромат?"" нет отбоя! Я покупкой довольна!Спасибо Каспи Магазину за такую возможность";Все;Такого нет;russian;5.0
Супер;Очень классный запах, оставляет шлейф;Нет;russian;5.0
Стойкость на 2 дня. В целом хороший.;Запах сладковатый. Не для лета, скорее для зимнего сезона. И еще запах не только для мужчины, кажется, для женщин тоже подходит. Унисекс, я бы сказал. Но в целом хороший запах, я вам скажу так.) ;Не для летнего времени. Сначала запах такой резкий, но через 10-20 минут нормально.;russian;5.0
Отличная цена и быстрая доставка. Доставили раньше времени. Спасибо большое!;Шикарный аромат, крепкий и со шлейфом. Очень нравится.;Никаких претензий.;russian;5.0
Запах приятный, немного сладковатый.;Дизайн очень красивый, понравилось. Доставили быстро.;Вроде все нормально, только сильно брызгает. Жестковат верхний колпачок.;russian;4.0
В kaspi.kz всё очень просто, быстро и удобно, качество тоже неплохое.;Мне всё понравилось и запах и доставка.;Вроде всё  нормально;russian;5.0
Ожидала лучшего;Запах не стойкий;Запах такой же, но вообще не стойкий;russian;1.0
Рекомендую;Мой любимый аромат, все соответствует качественным духам);Нет замечаний, все супер;russian;5.0
Советую всем;Мне очень понравился этот парфюм;Нет;russian;5.0
Но все равно спасибо);Запах очень классный, реально стоит своих денег!;Два дня ждал доставку :(;russian;5.0
Заказывала 2 разных аромата, они пришли в одинаковых флаконах. Теперь путаюсь, где какой из них) Это показалось странным.;Аромат стойкий, приятный.;Цвет флакона обычный серебристый, а не розовый.;russian;4.0
"Аромат очень насыщенный, густой, дымный, смольный, чуть-чуть пудровость заметна, скорее всего, ирис, примерно для 25+ подойдет. На мне сидит ближе к коже, с одежды слетает быстро, а вот на коже держится часа 4. Шлейф умеренный и недолгий, конечно, если половину флакона не вылить на себя, но это уже больше будет походить на ""химическую атаку"".) По стойкости, хоть и стоит концентрация EDP, держится не более 4-5 часов на коже. Этот аромат не для мужчин с милой женственной внешностью. Настоящая парфюмерная вода, и в ней нет той химозности, как от дешевых EDT. Рекомендую к покупке.";Товар качественный, оригинальный. Был очень хорошо упакован.;Не нашел.;russian;5.0
"Раньше я использовала только распив от такого же аромата и, соответственно, то, как выглядит натур продукт, не знала и заказала этот аромат. Но оказалось, это совсем не то, к сожалению. Нужно было брать другой Excentric Molecules.
В любом случае, сам аромат отличный, но при первичном нанесении имеется резкий запах спирта";Товар отличный. Лучше всего использовать после душа и нанесения любимого лосьона. Особо запах не ощущается, но чувствуется приятный шлейф после использования;На самом деле ожидала другой аромат этой же серии;russian;5.0
Не берите, друзья.;Единственное, что понравилось, это доставка.;Полное разочарование, голимый спирт.;russian;1.0
Будем пользоваться;Доставили быстро! Качество товара хорошее!;Всё понравилось;russian;5.0
